{
  "id": "doc-001",
  "tenant_id": "tenant-alpha",
  "title": "Security Architecture",
  "doc_type": "policy",
  "status": "approved",
  "classification": "restricted",
  "owner": "security@ppm.example",
  "created_at": "2026-03-10T08:30:00Z",
  "updated_at": "2026-04-01T12:00:00Z",
  "metadata": {
    "repository": "confluence"
  }
}
